{
  "schema_version": 1,
  "benchmark": "CP_LQR_FIN_REA_CONVERGE",
  "tool": "sosbc",
  "setting": "setting_1",
  "verdict": "unsupported",
  "expected_result": "reachable",
  "agrees_with_expected": null,
  "detail": "non-polynomial dynamics (trigonometric/exponential terms); SOS programming needs polynomial dynamics",
  "time_horizon": [0.0, 12.0],
  "horizon_covered": null,
  "reach_time_bounds": null,
  "runtime_s": {
    "total": 0.06161229097051546
  },
  "params": {
    "matlab_release": "R2025a",
    "deg_B": 16,
    "boundary_condition": true,
    "timeout_s": 1800
  },
  "provenance": {
    "git_commit": "1902bfc47358c2cb78390be8678192f28ead9249",
    "git_dirty": false,
    "timestamp": "2026-10-15T11:43:48+00:00",
    "platform": "macOS-27.0.1-arm64-arm-64bit",
    "machine": "arm64",
    "versions": {
      "python": "3.12.15",
      "sympy": "1.14.0"
    }
  },
  "extra": {}
}
