{
  "schema_version": 1,
  "benchmark": "DUFF_FIN_REA_NONCONVEX_LEVEL_SET",
  "tool": "krtb",
  "setting": "setting_0",
  "verdict": "reachable_witness",
  "expected_result": "reachable",
  "agrees_with_expected": true,
  "detail": "witness reaches the target at t = 5.165",
  "time_horizon": [0.0, 6.0],
  "horizon_covered": true,
  "reach_time_bounds": [
    [5.057429054333465, 5.8268064577759615]
  ],
  "runtime_s": {
    "total": 2.4144991250068415,
    "setup": 0.018017667025560513,
    "eigenpairs": 2.38130708297831,
    "bounds": 0.008322542009409517,
    "krtb": 2.3896296249877196,
    "witness_search": 0.006851832993561402
  },
  "params": {
    "num_samples_initial": 1000,
    "num_samples_target": 1000,
    "boundary_samples_initial": 0,
    "boundary_samples_target": 0,
    "num_sim_samples": 100,
    "seed": 0,
    "path_integral": {
      "rtol": 1e-12,
      "atol": 1e-14,
      "batch": 64,
      "dt": 0.02
    },
    "eigenfunctions": {
      "method": "path_integral",
      "equilibrium": [1, 0],
      "T": 100
    }
  },
  "provenance": {
    "git_commit": "f343df849dabd991bb9795c662d80ecb86e3c855",
    "git_dirty": true,
    "timestamp": "2026-10-25T19:40:50+00:00",
    "platform": "macOS-27.0.1-arm64-arm-64bit",
    "machine": "arm64",
    "versions": {
      "python": "3.12.15",
      "numpy": "2.2.6",
      "scipy": "1.18.1",
      "sympy": "1.14.0",
      "cvxpy": "1.9.3",
      "Mosek": "11.2.6"
    }
  },
  "extra": {
    "direction": "forward",
    "eigenvalues": [
      [-0.24999999999999994, 1.3919410907075052],
      [-0.24999999999999994, -1.3919410907075052]
    ],
    "eigenfunctions": {
      "method": "path_integral",
      "equilibrium": [1.0, 0.0],
      "T": 100,
      "rtol": 1e-12,
      "atol": 1e-14,
      "quadrature_points": 5001,
      "spectral_margin": 0.24999999999999994,
      "min_truncation_time": 98.26,
      "max_relative_integrand_at_truncation": 4.749706236441893e-11
    },
    "bounds_status": "bounded",
    "bounds_unclipped": [
      [5.057429054333465, 5.8268064577759615]
    ],
    "magnitude_interval": [3.8116999798703772, 7.6080611505238],
    "phase_window": [-3.9705181039560107, -3.2011407005135135],
    "period": 4.5139735791447375,
    "bound_details": {
      "magnitude": {
        "growing_cone": ["-inf", "inf"],
        "decaying_cone": [3.8116999798703772, 7.6080611505238],
        "lfp_status": ["infeasible", "infeasible", "optimal", "optimal"]
      },
      "phase": {
        "lfp_status": ["optimal", "optimal"],
        "weights": [1.0, -0.0]
      }
    },
    "witness": {
      "x0": [-0.8158250931215308, 1.91549405496554],
      "first_hit_time": 5.16546392481839,
      "inside_bounds": true
    },
    "num_samples": {
      "initial": 1000,
      "target": 1000
    }
  }
}
