{
  "schema_version": 1,
  "benchmark": "DUFF_FIN_UNR_BALL",
  "tool": "ground_truth",
  "setting": "simulation",
  "verdict": "unreachable_estimated",
  "expected_result": "unreachable",
  "agrees_with_expected": true,
  "detail": "no sampled trajectory reaches the target; closest approach 0.01672 (euclidean_distance)",
  "time_horizon": [0.0, 6.0],
  "horizon_covered": true,
  "reach_time_bounds": null,
  "runtime_s": {
    "total": 1.298105665948242
  },
  "params": {
    "direction": "forward",
    "integrator": "DOP853",
    "rtol": 1e-09,
    "atol": 1e-11,
    "event_detection": true
  },
  "provenance": {
    "git_commit": "92be6c35b44223cdb2424cbb7a30f4ab435538b0",
    "git_dirty": false,
    "timestamp": "2026-10-15T07:10:18+00:00",
    "platform": "macOS-27.0.1-arm64-arm-64bit",
    "machine": "arm64",
    "versions": {
      "python": "3.12.15",
      "numpy": "2.2.6",
      "scipy": "1.18.1",
      "sympy": "1.14.0"
    }
  },
  "extra": {
    "samples": {
      "interior": 400,
      "boundary": 400,
      "unique_initial_points": 800,
      "seed": 0
    },
    "num_hitting": 0,
    "num_trajectories": 800,
    "closest_approach": {
      "value": 0.016715523156940748,
      "kind": "euclidean_distance",
      "x0": [-0.6945801693826241, 1.833238466914891],
      "time": 2.625
    },
    "max_domain_violation": 0.0,
    "problems": [],
    "info": []
  }
}
