{
  "schema_version": 1,
  "benchmark": "CP_LQR_FIN_REA_UNSAFE",
  "tool": "juliareach",
  "setting": "setting_0",
  "verdict": "reachable_proven",
  "expected_result": "reachable",
  "agrees_with_expected": true,
  "detail": "76 flowpipe segments lie inside the target",
  "time_horizon": [0.0, 10.0],
  "horizon_covered": true,
  "reach_time_bounds": [
    [0.6770137737875871, 0.8572371053610868]
  ],
  "runtime_s": {
    "total": 26.127853374986444,
    "compile_warmup": 6.271627792,
    "solve": 13.0036855,
    "check": 1.174794083
  },
  "params": {
    "julia": "1.13.1",
    "abstol": 1e-10,
    "orderT": 5,
    "orderQ": 1,
    "maxsteps": 20000,
    "taylorize": true,
    "timeout_s": 1800,
    "initial_splits": 1,
    "versions": {
      "JSON3": "1.14.3",
      "julia": "1.13.1",
      "TaylorModels": "0.11.1",
      "LazySets": "7.1.0",
      "IntervalArithmetic": "1.0.12",
      "ReachabilityAnalysis": "0.33.0"
    }
  },
  "provenance": {
    "git_commit": "9c347960b4b6317b9f8f63d9363064cef445d8f6",
    "git_dirty": false,
    "timestamp": "2026-10-15T10:12:39+00:00",
    "platform": "macOS-27.0.1-arm64-arm-64bit",
    "machine": "arm64",
    "versions": {
      "python": "3.12.15"
    }
  },
  "extra": {
    "horizon_covered": true,
    "flowpipe_end_time": 10.0,
    "num_segments": 3050,
    "num_possible": 4,
    "num_inside": 76,
    "initial_set_overapproximated": false,
    "num_initial_boxes": 1
  }
}
