{
  "schema_version": 1,
  "benchmark": "MAS_CON_FIN_UNR_SAFE_1",
  "tool": "juliareach",
  "setting": "setting_1",
  "verdict": "unreachable_proven",
  "expected_result": "unreachable",
  "agrees_with_expected": true,
  "detail": "all 519 flowpipe segments are disjoint from the target",
  "time_horizon": [0.0, 7.0],
  "horizon_covered": true,
  "reach_time_bounds": [],
  "runtime_s": {
    "total": 160.59720858297078,
    "compile_warmup": 110.073631916,
    "solve": 43.348775917,
    "check": 1.154431041
  },
  "params": {
    "julia": "1.13.1",
    "abstol": 1e-10,
    "orderT": 5,
    "orderQ": 1,
    "maxsteps": 20000,
    "taylorize": true,
    "timeout_s": 1800,
    "initial_splits": 1,
    "versions": {
      "JSON3": "1.14.3",
      "julia": "1.13.1",
      "TaylorModels": "0.11.1",
      "LazySets": "7.1.0",
      "IntervalArithmetic": "1.0.12",
      "ReachabilityAnalysis": "0.33.0"
    }
  },
  "provenance": {
    "git_commit": "9c347960b4b6317b9f8f63d9363064cef445d8f6",
    "git_dirty": false,
    "timestamp": "2026-10-15T10:34:40+00:00",
    "platform": "macOS-27.0.1-arm64-arm-64bit",
    "machine": "arm64",
    "versions": {
      "python": "3.12.15"
    }
  },
  "extra": {
    "horizon_covered": true,
    "flowpipe_end_time": 7.0,
    "num_segments": 519,
    "num_possible": 0,
    "num_inside": 0,
    "initial_set_overapproximated": false,
    "num_initial_boxes": 1
  }
}
