{
  "schema_version": 1,
  "benchmark": "NL_SLC_FIN_REA_BOX",
  "tool": "krtb",
  "setting": "setting_0",
  "verdict": "reachable_witness",
  "expected_result": "reachable",
  "agrees_with_expected": true,
  "detail": "witness reaches the target at t = 6.474",
  "time_horizon": [0.0, 15.0],
  "horizon_covered": true,
  "reach_time_bounds": [
    [6.429228938565771, 6.6263985092287125],
    [12.712414245745357, 12.909583816408299]
  ],
  "runtime_s": {
    "total": 0.07104379200609401,
    "setup": 0.042850667028687894,
    "eigenfunctions": 0.00028325000312179327,
    "bounds": 0.015661749988794327,
    "krtb": 0.01594499999191612,
    "witness_search": 0.012248124985489994
  },
  "params": {
    "num_samples_initial": 2000,
    "num_samples_target": 2000,
    "boundary_samples_initial": 0,
    "boundary_samples_target": 0,
    "num_sim_samples": 100,
    "seed": 0,
    "path_integral": {
      "rtol": 1e-12,
      "atol": 1e-14,
      "batch": 64,
      "dt": 0.02
    },
    "eigenfunctions": {
      "method": "analytic",
      "functions": ["(1 - x1^2 - x2^2)^2*exp(I*atan2(x2, x1))", "(1 - x1^2 - x2^2)^2*exp(-I*atan2(x2, x1))"],
      "eigenvalues": ["-1-1j", "-1+1j"]
    }
  },
  "provenance": {
    "git_commit": "6bce0a9e9e91719373f4cfad5a75946a05cbb6dd",
    "git_dirty": false,
    "timestamp": "2026-10-15T08:06:03+00:00",
    "platform": "macOS-27.0.1-arm64-arm-64bit",
    "machine": "arm64",
    "versions": {
      "python": "3.12.15",
      "numpy": "2.2.6",
      "scipy": "1.18.1",
      "sympy": "1.14.0",
      "cvxpy": "1.9.3",
      "Mosek": "11.2.6"
    }
  },
  "extra": {
    "direction": "forward",
    "eigenvalues": [
      [-1.0, -1.0],
      [-1.0, 1.0]
    ],
    "eigenfunctions": {
      "method": "analytic",
      "functions": ["(1 - x1^2 - x2^2)^2*exp(I*atan2(x2, x1))", "(1 - x1^2 - x2^2)^2*exp(-I*atan2(x2, x1))"],
      "max_relative_eigen_residual": 5.512089143795366e-14
    },
    "bounds_status": "bounded",
    "bounds_unclipped": [
      [6.429228938565771, 6.6263985092287125],
      [12.712414245745357, 12.909583816408299]
    ],
    "magnitude_interval": [4.234304606824461, 13.463143255215273],
    "phase_window": [0.1460436313861848, 0.34321320204912675],
    "period": 6.283185307179586,
    "bound_details": {
      "magnitude": {
        "growing_cone": ["-inf", "inf"],
        "decaying_cone": [4.234304606824461, 13.463143255215273],
        "lfp_status": ["infeasible", "infeasible", "optimal", "optimal"]
      },
      "phase": {
        "lfp_status": ["optimal", "optimal"],
        "weights": [0.0, 1.0]
      }
    },
    "witness": {
      "x0": [1.3, 1.3],
      "first_hit_time": 6.473622517079634,
      "inside_bounds": true
    },
    "num_samples": {
      "initial": 2000,
      "target": 2000
    }
  }
}
