{
  "schema_version": 1,
  "benchmark": "DUFF_FIN_REA_BALL",
  "tool": "ground_truth",
  "setting": "simulation",
  "verdict": "reachable_witness",
  "expected_result": "reachable",
  "agrees_with_expected": true,
  "detail": "33/800 sampled trajectories reach the target",
  "time_horizon": [0.0, 6.0],
  "horizon_covered": true,
  "reach_time_bounds": null,
  "runtime_s": {
    "total": 1.2543593749869615
  },
  "params": {
    "integrator": "DOP853",
    "rtol": 1e-09,
    "atol": 1e-11,
    "event_detection": true
  },
  "provenance": {
    "git_commit": "39ca36683c521472e929ff667326a0aea933e5b5",
    "git_dirty": false,
    "timestamp": "2026-10-14T17:27:03+00:00",
    "platform": "macOS-27.0.1-arm64-arm-64bit",
    "machine": "arm64",
    "versions": {
      "python": "3.12.15",
      "numpy": "2.2.6",
      "scipy": "1.18.1",
      "sympy": "1.14.0"
    }
  },
  "extra": {
    "samples": {
      "interior": 400,
      "boundary": 400,
      "unique_initial_points": 800,
      "seed": 0
    },
    "num_hitting": 33,
    "num_trajectories": 800,
    "closest_approach": {
      "value": -0.002364112789494943,
      "kind": "euclidean_distance",
      "x0": [-0.6945801693826241, 1.8632384669148907],
      "time": 2.586
    },
    "max_domain_violation": 0.0,
    "problems": [],
    "info": [],
    "witness": {
      "x0": [-0.6890610233449358, 1.8592870804370647],
      "first_hit_time": 2.562
    },
    "first_hit_time_range": [2.562, 2.601]
  }
}
