{
  "schema_version": 1,
  "benchmark": "DUFF_FIN_UNR_BALL",
  "tool": "cora",
  "setting": "setting_1",
  "verdict": "reachable_possible",
  "expected_result": "unreachable",
  "agrees_with_expected": null,
  "detail": "67 of 36000 reachable sets may intersect the target (initial set over-approximated by 60 boxes)",
  "time_horizon": [0.0, 6.0],
  "horizon_covered": true,
  "reach_time_bounds": [
    [2.5300000000000002, 2.71]
  ],
  "runtime_s": {
    "total": 187.5211474589887,
    "warmup": 0.6196474166666667,
    "reach": 180.57462370833332,
    "check": 1.7918616249999995
  },
  "params": {
    "matlab_release": "R2025a",
    "alg": "lin",
    "tensorOrder": 2,
    "taylorTerms": 4,
    "zonotopeOrder": 50,
    "timeStep": 0.01,
    "initial_splits": 8,
    "timeout_s": 3600,
    "versions": {
      "matlab": "25.1.0.2973910 (R2025a) Update 1",
      "cora": "CORA v2026.1.0"
    }
  },
  "provenance": {
    "git_commit": "f343df849dabd991bb9795c662d80ecb86e3c855",
    "git_dirty": true,
    "timestamp": "2026-10-25T18:40:45+00:00",
    "platform": "macOS-27.0.1-arm64-arm-64bit",
    "machine": "arm64",
    "versions": {
      "python": "3.12.15"
    }
  },
  "extra": {
    "horizon_covered": true,
    "reachable_set_end_time": 6,
    "num_segments": 36000,
    "num_possible": 67,
    "num_inside": 0,
    "initial_set_overapproximated": true,
    "num_initial_boxes": 60
  }
}
