{
  "schema_version": 1,
  "benchmark": "NL_EIG_FIN_BACKWARD_REA_BOX",
  "tool": "hj",
  "setting": "setting_0",
  "verdict": "reachable_estimated",
  "expected_result": "reachable",
  "agrees_with_expected": true,
  "detail": "min V over the initial set -0.0212 <= -0.00802",
  "time_horizon": [0.0, 1.3],
  "horizon_covered": true,
  "reach_time_bounds": null,
  "runtime_s": {
    "setup": 0.04319916700478643,
    "compile_and_first_step": 0.17712408298393711,
    "solve": 8.79722375003621,
    "total": 9.027999040961731
  },
  "params": {
    "grid_size": 500,
    "accuracy": "medium",
    "time_step_report": 0.005,
    "margin_cells": 1.0,
    "num_samples_initial": 2000,
    "boundary_samples_initial": 2000,
    "seed": 0
  },
  "provenance": {
    "git_commit": "74b1e35eedcb16ed22408112711371941c49b1d6",
    "git_dirty": false,
    "timestamp": "2026-10-15T09:47:56+00:00",
    "platform": "macOS-27.0.1-arm64-arm-64bit",
    "machine": "arm64",
    "versions": {
      "python": "3.12.15",
      "numpy": "2.2.6",
      "sympy": "1.14.0",
      "jax": "0.11.2",
      "jaxlib": "0.11.2",
      "hj_reachability": "0.7.0"
    }
  },
  "extra": {
    "direction": "backward",
    "grid_shape": [500, 500],
    "grid_spacing": [0.008016032166779041, 0.008016032166779041],
    "margin": 0.008016032166779041,
    "min_value_over_initial": -0.021247005090117455,
    "first_reach_time_estimate": 0.8150000000000001,
    "num_initial_samples": 4004,
    "jax_devices": ["cpu:0"]
  }
}
